text,created_at,retweet_count,favorite_count,is_retweet
.@FLOTUS Melania and I join millions of people around the world in mourning the passing of Billy Graham. Our prayers are with his children grandchildren great-grandchildren and all who worked closely with Reverend Graham in his lifelong ministry. https://t.co/e1697tcyaI,02-21-2018 21:12:45,18201,83667,false
Yesterday it was my great honor to recognize extraordinary Law Enforcement Officers and First Responders and to award them the the highest possible decoration for bravery by public safety officers the Medal of Valor. #AmericanHeroes https://t.co/em0wBbvy5P,02-21-2018 18:20:25,15075,74336,false
Question: If all of the Russian meddling took place during the Obama Administration right up to January 20th why aren't they the subject of the investigation? Why didn't Obama do something about the meddling? Why aren't Dem crimes under investigation? Ask Jeff Sessions!,02-21-2018 14:40:21,32325,115969,false
The GREAT Billy Graham is dead. There was nobody like him! He will be missed by Christians and all religions. A very special man.,02-21-2018 14:22:07,29719,150289,false
Question: If all of the Russian meddling took place during the Obama Administration right up to January 20th why aren't they the subject of the investigation? Why didn't Obama do something about the meddling? Why aren't Dem crimes under investigation? Ask Jeff Session!,02-21-2018 14:03:32,6336,21118,false
@CNN @MSNBC Whether we are Republican or Democrat we must now focus on strengthening Background Checks!,02-21-2018 01:18:36,16129,81372,false
So true thank you! https://t.co/9TTXlfokYz,02-21-2018 01:14:19,21826,97813,false
Bad ratings @CNN &; @MSNBC got scammed when they covered the anti-Trump Russia rally wall-to-wall. They probably knew it was Fake News but because it was a rally against me they pushed it hard anyway. Two really dishonest newscasters but the public is wise!,02-21-2018 01:08:00,22372,95052,false
Main Street is BOOMING thanks to our incredible TAX CUT and Reform law. "This shows small-business owners are more than just optimistic they are ready to grow their businesses." https://t.co/w9aw68UwOj,02-20-2018 17:49:07,17507,74716,false
....cameras running. Another False Accusation. Why doesn't @washingtonpost report the story of the women taking money to make up stories about me? One had her home mortgage paid off. Only @FoxNews so reported...doesn't fit the Mainstream Media narrative.,02-20-2018 15:29:07,19693,79159,false
A woman I don't know and to the best of my knowledge never met is on the FRONT PAGE of the Fake News Washington Post saying I kissed her (for two minutes yet) in the lobby of Trump Tower 12 years ago. Never happened! Who would do this in a public space with live security......,02-20-2018 15:16:06,21676,96352,false
I have been much tougher on Russia than Obama just look at the facts. Total Fake News!,02-20-2018 13:38:49,16216,77951,false
Hope Republicans in the Great State of Pennsylvania challenge the new "pushed" Congressional Map all the way to the Supreme Court if necessary. Your Original was correct! Don't let the Dems take elections away from you so that they can raise taxes &; waste money!,02-20-2018 13:11:58,20211,79178,false
Matt Schlapp and CPAC are getting ready for another exciting event. Big difference from those days when President Obama held the White House. You've come a long way Matt!,02-20-2018 13:03:53,10176,51701,false
Republicans are now leading the Generic Poll perhaps because of the popular Tax Cuts which the Dems want to take away. Actually they want to raise you taxes substantially. Also they want to do nothing on DACA R's want to fix!,02-20-2018 12:54:39,17161,82044,false
....The President Obama quote just before election. That's because he thought Crooked Hillary was going to win and he didn't want to "rock the boat." When I easily won the Electoral College the whole game changed and the Russian excuse became the narrative of the Dems.,02-20-2018 12:46:18,20699,85341,false
"There is no serious person out there who would suggest somehow that you could even rig America's elections there's no evidence that that has happened in the past or that it will happen this time and so I'd invite Mr. Trump to stop whining and make his case to get votes." .....,02-20-2018 12:37:20,17403,67815,false
Thank you to @foxandfriends for the great timeline on all of the failures the Obama Administration had against Russia including Crimea Syria and so much more. We are now starting to win again!,02-20-2018 12:24:54,14655,66368,false
"The Faith of Donald Trump" a book just out by David Brody and Scott Lamb is a very interesting read. Enjoy!,02-20-2018 02:48:02,13259,68243,false
The U.S. economy is looking very good in my opinion even better than anticipated. Companies are pouring back into our country reversing the long term trend of leaving. The unemployment numbers are looking great and Regulations &; Taxes have been massively Cut! JOBS JOBS JOBS,02-20-2018 02:29:29,25306,120633,false
.@MittRomney has announced he is running for the Senate from the wonderful State of Utah. He will make a great Senator and worthy successor to @OrrinHatch and has my full support and endorsement!,02-20-2018 02:21:08,9387,55014,false
Obama was President up to and beyond the 2016 Election. So why didn't he do something about Russian meddling?,02-19-2018 19:55:49,22285,91374,false
Have a great but very reflective President's Day!,02-19-2018 13:42:10,23877,144230,false
Just watched a very insecure Oprah Winfrey who at one point I knew very well interview a panel of people on 60 Minutes. The questions were biased and slanted the facts incorrect. Hope Oprah runs so she can be exposed and defeated just like all of the others!,02-19-2018 04:28:40,34437,153608,false
My great friends from NASCAR are having their big race today The Daytona 500. Brian France and the France family are special people. Enjoy the race!,02-18-2018 19:13:02,15542,102112,false
Thank you to KenStarr former Independent Counsel Whitewater for your insight and powerful words on FISA abuse Russian meddling etc. Really great interview with @MariaBartiromo,02-18-2018 17:10:32,17974,77496,false
Great Pollster John McLaughlin now has the GOP up in the Generic Congressional Ballot. Big gain over last 4 weeks. I guess people are loving the big Tax Cuts given them by the Republicans the Cuts the Dems want to take away. We need more Republicans!,02-18-2018 13:55:55,21861,97209,false
The Fake News of big ratings loser CNN. https://t.co/rYsv90cnvs,02-18-2018 13:46:39,19637,76885,false
If it was the GOAL of Russia to create discord disruption and chaos within the U.S. then with all of the Committee Hearings Investigations and Party hatred they have succeeded beyond their wildest dreams. They are laughing their asses off in Moscow. Get smart America!,02-18-2018 13:11:28,33016,118306,false
RT @mike_pence: Big night. Largest-ever Dallas County GOP Reagan Day Dinner. As I told the crowd under President @realDonaldTrump: Promise…,02-18-2018 12:53:11,12888,0,true
Now that Adam Schiff is starting to blame President Obama for Russian meddling in the election he is probably doing so as yet another excuse that the Democrats lead by their fearless leader Crooked Hillary Clinton lost the 2016 election. But wasn't I a great candidate?,02-18-2018 12:43:48,19735,90179,false
I never said Russia did not meddle in the election I said "it may be Russia or China or another country or group or it may be a 400 pound genius sitting in bed and playing with his computer." The Russian "hoax" was that the Trump campaign colluded with Russia - it never did!,02-18-2018 12:33:16,31757,127176,false
Finally Liddle' Adam Schiff the leakin' monster of no control is now blaming the Obama Administration for Russian meddling in the 2016 Election. He is finally right about something. Obama was President knew of the threat and did nothing. Thank you Adam!,02-18-2018 12:22:29,28411,108688,false
Never gotten over the fact that Obama was able to send $1.7 Billion Dollars in CASH to Iran and nobody in Congress the FBI or Justice called for an investigation!,02-18-2018 12:02:52,38387,124701,false
General McMaster forgot to say that the results of the 2016 election were not impacted or changed by the Russians and that the only Collusion was between Russia and Crooked H the DNC and the Dems. Remember the Dirty Dossier Uranium Speeches Emails and the Podesta Company!,02-18-2018 04:22:48,27037,96734,false
Very sad that the FBI missed all of the many signals sent out by the Florida school shooter. This is not acceptable. They are spending too much time trying to prove Russian collusion with the Trump campaign - there is no collusion. Get back to the basics and make us all proud!,02-18-2018 04:08:45,37025,149114,false
Just like they don't want to solve the DACA problem why didn't the Democrats pass gun control legislation when they had both the House &; Senate during the Obama Administration. Because they didn't want to and now they just talk!,02-17-2018 23:45:28,32193,122987,false
"I have seen all of the Russian ads and I can say very definitively that swaying the election was *NOT* the main goal."Rob GoldmanVice President of Facebook Ads https://t.co/A5ft7cGJkE,02-17-2018 20:16:39,17148,58403,false
The Fake News Media never fails. Hard to ignore this fact from the Vice President of Facebook Ads Rob Goldman! https://t.co/XGC7ynZwYJ,02-17-2018 20:11:32,18770,60818,false
Funny how the Fake News Media doesn't want to say that the Russian group was formed in 2014 long before my run for President. Maybe they knew I was going to run even though I didn't know!,02-17-2018 19:46:48,25523,105922,false
Deputy A.G. Rod Rosenstein stated at the News Conference: "There is no allegation in the indictment that any American was a knowing participant in this illegal activity. There is no allegation in the indictment that the charged conduct altered the outcome of the 2016 election.,02-17-2018 19:36:14,21867,90335,false
"Charges Deal Don A Big Win" written by Michael Goodwin of the @nypost succinctly states that "the Russians had no impact on the election results." There was no Collusion with the Trump Campaign. "She lost the old-fashioned way by being a terrible candidate. Case closed.",02-17-2018 19:26:13,18892,71274,false
Melania and I met such incredible people last night in Broward County Florida. Will never forget them or the evening!,02-17-2018 19:04:43,14745,97126,false
Our entire Nation w/one heavy heart continues to pray for the victims &; their families in Parkland FL. To teachers law enforcement first responders &; medical professionals who responded so bravely in the face of danger: We THANK YOU for your courage! https://t.co/3yJsrebZMG https://t.co/ti791dENTy,02-17-2018 04:53:13,24716,118119,false
Russia started their anti-US campaign in 2014 long before I announced that I would run for President. The results of the election were not impacted. The Trump campaign did nothing wrong - no collusion!,02-16-2018 20:18:11,37049,141288,false
Cannot believe how BADLY DACA recipients have been treated by the Democrats...totally abandoned! Republicans are still working hard.,02-16-2018 14:49:54,21900,97235,false
I will be leaving for Florida today to meet with some of the bravest people on earth - but people whose lives have been totally shattered. Am also working with Congress on many fronts.,02-16-2018 14:37:56,19836,120054,false
Presidential Proclamation Honoring the Victims of the Tragedy in Parkland Florida: https://t.co/RTQWAKiSnR https://t.co/Nhs32bm5zB,02-15-2018 20:19:11,13591,61970,false
...lottery continues deadly catch-and-release and bars enforcement even for FUTURE illegal immigrants. Voting for this amendment would be a vote AGAINST law enforcement and a vote FOR open borders. If Dems are actually serious about DACA they should support the Grassley bill!,02-15-2018 19:26:09,15254,60189,false
The Schumer-Rounds-Collins immigration bill would be a total catastrophe. @DHSgov says it would be "the end of immigration enforcement in America." It creates a giant amnesty (including for dangerous criminals) doesn't build the wall expands chain migration keeps the visa...,02-15-2018 19:25:23,20026,72298,false
RT @SpoxDHS: Schumer-Rounds-Collins destroys the ability of @DHSgov to enforce immigration laws creating a mass amnesty for over 10 millio…,02-15-2018 19:22:16,7999,0,true
In times of tragedy the bonds that sustain us are those of family faith community and country. These bonds are stronger than the forces of hatred and evil - and these bonds grow even stronger in the hours of our greatest need. https://t.co/bu140nscez https://t.co/OoTXMCSexB,02-15-2018 17:33:41,19695,82584,false
While the Republicans and Democrats in Congress are working hard to come up with a solution to DACA they should be strongly considering a system of Merit Based Immigration so that we will have the people ready willing and able to help all of those companies moving into the USA!,02-15-2018 14:57:21,20642,100976,false
So many signs that the Florida shooter was mentally disturbed even expelled from school for bad and erratic behavior. Neighbors and classmates knew he was a big problem. Must always report such instances to authorities again and again!,02-15-2018 12:12:41,20780,89071,false
Just spoke to Governor Rick Scott. We are working closely with law enforcement on the terrible Florida school shooting.,02-14-2018 20:55:01,19524,111834,false
My prayers and condolences to the families of the victims of the terrible Florida shooting. No child teacher or anyone else should ever feel unsafe in an American school.,02-14-2018 20:50:11,39628,174183,false
Today I was honored to be joined by Republicans and Democrats from both the House and Senate as well as members of my Cabinet - to discuss the urgent need to rebuild and restore America's depleted infrastructure. https://t.co/8ByoQJsjTT https://t.co/BVBRDvHfcC,02-14-2018 19:11:32,11359,56369,false
As we come together to celebrate the extraordinary contributions of African-Americans to our nation our thoughts turn to the heroes of the civil rights movement whose courage and sacrifice have inspired us all. Proclamation: https://t.co/Sw1iGIJgWV https://t.co/Nx0AEKZy5p,02-14-2018 18:15:12,15026,65423,false
Negotiations on DACA have begun. Republicans want to make a deal and Democrats say they want to make a deal. Wouldn't it be great if we could finally after so many years solve the DACA puzzle. This will be our last chance there will never be another opportunity! March 5th.,02-13-2018 10:52:47,22659,107190,false
Our infrastructure plan has been put forward and has received great reviews by everyone except of course the Democrats. After many years we have taken care of our Military now we have to fix our roads bridges tunnels airports and more. Bipartisan make deal Dems?,02-13-2018 10:43:22,22903,105996,false
The journey to #MAGA began @CPAC 2011 and the opportunity to reconnect with friends and supporters is something I look forward to every year. See you at #CPAC2018!,02-12-2018 20:48:16,14387,67800,false
Thank you to Sue Kruczek who lost her wonderful and talented son Nick to the Opioid scourge for your kind words while on @foxandfriends. We are fighting this terrible epidemic hard - Nick will not have died in vain!,02-12-2018 12:54:32,16854,87081,false
This will be a big week for Infrastructure. After so stupidly spending $7 trillion in the Middle East it is now time to start investing in OUR Country!,02-12-2018 12:46:56,30446,139472,false
Just spoke to @JohnKasich to express condolences and prayers to all for the horrible shooting of two great police officers from @WestervillePD. This is a true tragedy!,02-11-2018 20:36:08,14954,77715,false
Rep. Lou Barletta a Great Republican from Pennsylvania who was one of my very earliest supporters will make a FANTASTIC Senator. He is strong &; smart loves Pennsylvania &; loves our Country! Voted for Tax Cuts unlike Bob Casey who listened to Tax Hikers Pelosi and Schumer!,02-11-2018 20:26:03,24147,97505,false
4.2 million hard working Americans have already received a large Bonus and/or Pay Increase because of our recently Passed Tax Cut &; Jobs Bill....and it will only get better! We are far ahead of schedule.,02-11-2018 19:15:32,25082,125039,false
So many positive things going on for the U.S.A. and the Fake News Media just doesn't want to go there. Same negative stories over and over again! No wonder the People no longer trust the media whose approval ratings are correctly at their lowest levels in history!    #MAGA,02-11-2018 18:21:48,31128,123868,false
My Administration has identified three major priorities for creating a safe modern and lawful immigration system: fully securing the border ending chain migration and canceling the visa lottery. Congress must secure the immigration system and protect Americans. https://t.co/xV1lgfhjBU,02-10-2018 23:34:08,32066,119333,false
My thoughts and prayers are with the two police officers their families and everybody at the @WestervillePD. https://t.co/AoingY77Ky,02-10-2018 21:18:23,20517,85046,false
Republicans want to fix DACA far more than the Democrats do. The Dems had all three branches of government back in 2008-2011 and they decided not to do anything about DACA. They only want to use it as a campaign issue. Vote Republican!,02-10-2018 18:50:02,30571,118224,false
....agencies not just the FBI &; DOJ now the State Department to dig up dirt on him in the days leading up to the Election. Comey had conversations with Donald Trump which I don't believe were accurate...he leaked information (corrupt)." Tom Fitton of Judicial Watch on @FoxNews,02-10-2018 18:34:49,19990,75810,false
"My view is that not only has Trump been vindicated in the last several weeks about the mishandling of the Dossier and the lies about the Clinton/DNC Dossier it shows that he's been victimized. He's been victimized by the Obama Administration who were using all sorts of.......,02-10-2018 18:16:20,25875,101513,false
Peoples lives are being shattered and destroyed by a mere allegation. Some are true and some are false. Some are old and some are new. There is no recovery for someone falsely accused - life and career are gone. Is there no such thing any longer as Due Process?,02-10-2018 15:33:35,37304,136957,false
According to the @nytimes a Russian sold phony secrets on "Trump" to the U.S. Asking price was $10 million brought down to $1 million to be paid over time. I hope people are now seeing &; understanding what is going on here. It is all now starting to come out - DRAIN THE SWAMP!,02-10-2018 15:20:05,32882,105760,false
The Democrats sent a very political and long response memo which they knew because of sources and methods (and more) would have to be heavily redacted whereupon they would blame the White House for lack of transparency. Told them to re-do and send back in proper form!,02-10-2018 14:20:35,32384,117713,false
Jobless claims have dropped to a 45 year low!,02-10-2018 14:02:54,13834,64927,false
Costs on non-military lines will never come down if we do not elect more Republicans in the 2018 Election and beyond. This Bill is a BIG VICTORY for our Military but much waste in order to get Dem votes. Fortunately DACA not included in this Bill negotiations to start now!,02-09-2018 13:59:13,21465,89668,false
Without more Republicans in Congress we were forced to increase spending on things we do not like or want in order to finally after many years of depletion take care of our Military. Sadly we needed some Dem votes for passage. Must elect more Republicans in 2018 Election!,02-09-2018 13:47:28,28187,110663,false
Just signed Bill. Our Military will now be stronger than ever before. We love and need our Military and gave them everything — and more. First time this has happened in a long time. Also means JOBS JOBS JOBS!,02-09-2018 13:39:15,27278,130615,false
Wow! -Senator Mark Warner got caught having extensive contact with a lobbyist for a Russian oligarch. Warner did not want a "paper trail" on a "private" meeting (in London) he requested with Steele of fraudulent Dossier fame. All tied into Crooked Hillary.,02-09-2018 03:22:53,39958,127896,false
Time to end the visa lottery. Congress must secure the immigration system and protect Americans. https://t.co/yukxm48x9X,02-08-2018 23:26:22,24162,97893,false
As long as we open our eyes to God's grace - and open our hearts to God's love - then America will forever be the land of the free the home of the brave and a light unto all nations. #NationalPrayerBreakfast https://t.co/1cwxs3l0uK,02-08-2018 20:10:58,30800,110326,false
I will be meeting with Henry Kissinger at 1:45pm. Will be discussing North Korea China and the Middle East.,02-08-2018 18:44:00,13629,79956,false
Our founders invoked our Creator four times in the Declaration of Independence. Our currency declares "IN GOD WE TRUST." And we place our hands on our hearts as we recite the Pledge of Allegiance and proclaim that we are "One Nation Under God." #NationalPrayerBreakfast https://t.co/zukP40Ezpo,02-08-2018 17:13:13,29398,107158,false
Will be heading over shortly to make remarks at The National Prayer Breakfast in Washington. Great religious and political leaders and many friends including T.V. producer Mark Burnett of our wonderful 14 season Apprentice triumph will be there. Looking forward to seeing all!,02-08-2018 11:08:39,17876,106381,false
The Budget Agreement today is so important for our great Military. It ends the dangerous sequester and gives Secretary Mattis what he needs to keep America Great. Republicans and Democrats must support our troops and support this Bill!,02-07-2018 22:36:15,23230,109471,false
Congratulations to the Republic of Korea on what will be a MAGNIFICENT Winter Olympics! What the South Korean people have built is truly an inspiration! https://t.co/giN2B1h6Ph,02-07-2018 22:13:16,13349,70576,false
Best wishes to the Republic of Korea on hosting the @Olympics! What a wonderful opportunity to show everyone that you are a truly GREAT NATION! https://t.co/aboM2Up48y,02-07-2018 18:01:05,12803,65509,false
NEW FBI TEXTS ARE BOMBSHELLS!,02-07-2018 16:10:00,39864,138202,false
In the "old days" when good news was reported the Stock Market would go up. Today when good news is reported the Stock Market goes down. Big mistake and we have so much good (great) news about the economy!,02-07-2018 14:59:49,22005,112672,false
Congratulations @ElonMusk and @SpaceX on the successful #FalconHeavy launch. This achievement along with @NASA's commercial and international partners continues to show American ingenuity at its best! https://t.co/eZfLSpyJPK,02-07-2018 03:05:45,31726,167618,false
HAPPY BIRTHDAY to our 40th President of the United States of America Ronald Reagan! https://t.co/JtEglBhm4c,02-07-2018 00:48:01,33058,181719,false
Today we heard the experiences of law enforcement professionals and community leaders working to combat the threat of MS-13 and the reforms we need from Congress to defeat it. Watch here: https://t.co/VPMTnko7Ik https://t.co/4OaXXuj9Va,02-06-2018 22:45:50,18392,76121,false
We need a 21st century MERIT-BASED immigration system.  Chain migration and the visa lottery are outdated programs that hurt our economic and national security. https://t.co/rP9Gtr2E5N,02-06-2018 16:05:42,25680,92746,false
Polling shows nearly 7 in 10 Americans support an immigration reform package that includes DACA fully secures the border ends chain migration &; cancels the visa lottery. If D's oppose this deal they aren't serious about DACA-they just want open borders. https://t.co/XDMcDOr9vM,02-06-2018 16:00:43,23645,89740,false
My prayers and best wishes are with the family of Edwin Jackson a wonderful young man whose life was so senselessly taken. @Colts,02-06-2018 13:37:00,20956,104741,false
So disgraceful that a person illegally in our country killed @Colts linebacker Edwin Jackson. This is just one of many such preventable tragedies. We must get the Dems to get tough on the Border and with illegal immigration FAST!,02-06-2018 13:32:57,36136,142978,false
Thanks to the historic TAX CUTS that I signed into law your paychecks are going way UP your taxes are going way DOWN and America is once again OPEN FOR BUSINESS! https://t.co/GISFbDDGXX,02-05-2018 20:42:01,22886,105977,false
Representative Devin Nunes a man of tremendous courage and grit may someday be recognized as a Great American Hero for what he has exposed and what he has had to endure!,02-05-2018 15:08:51,35787,133744,false
Any deal on DACA that does not include STRONG border security and the desperately needed WALL is a total waste of time. March 5th is rapidly approaching and the Dems seem not to care about DACA. Make a deal!,02-05-2018 14:36:40,30023,123371,false
Little Adam Schiff who is desperate to run for higher office is one of the biggest liars and leakers in Washington right up there with Comey Warner Brennan and Clapper! Adam leaves closed committee hearings to illegally leak confidential information. Must be stopped!,02-05-2018 12:39:10,43004,142317,false
Thank you to @foxandfriends for exposing the truth. Perhaps that's why your ratings are soooo much better than your untruthful competition!,02-05-2018 12:17:57,22763,107638,false
The Democrats are pushing for Universal HealthCare while thousands of people are marching in the UK because their U system is going broke and not working. Dems want to greatly raise taxes for really bad and non-personal medical care. No thanks!,02-05-2018 12:11:56,30625,120989,false
Congratulations to the Philadelphia Eagles on a great Super Bowl victory!,02-05-2018 03:54:42,36253,212429,false
My thoughts and prayers are with all of the victims involved in this mornings train collision in South Carolina. Thank you to our incredible First Responders for the work they've done!,02-04-2018 16:58:14,22937,141922,false
